{
  "schema_version": "1.0.0",
  "reproduction_id": "REPRODUCTION-INTERNAL-CLEAN-CLONE-000001",
  "classification": "INTERNAL_CLEAN_CLONE_SEPARATE_LIBRARY_REPRODUCTION",
  "repository": {
    "url": "https://github.com/chefmrfrizzle/TheCubedz.git",
    "commit": "8684c5ebc9dd0bd485b2ef91226aa3f2e37f7b39",
    "working_tree_clean": true
  },
  "environment": {
    "operating_system": "Windows-10-10.0.19045-SP0",
    "system": "Windows",
    "release": "10",
    "machine": "AMD64",
    "python_version": "3.12.13",
    "python_implementation": "CPython",
    "sympy_version": "1.14.0"
  },
  "commands": [
    "python scripts/research.py verify candidates/CANDIDATE-000001.json --reproducible",
    "python scripts/research.py verify candidates/CANDIDATE-000002.json --passport benchmarks/BENCHMARK-000002.passport.json --reproducible",
    "python independent/sympy_clean_clone_reproduction.py --json"
  ],
  "implementation": {
    "name": "sympy-clean-clone-matrix-reproduction",
    "library": "SymPy",
    "library_version": "1.14.0",
    "imports_research_core": false,
    "method": "SymPy Matrix determinant, inverse, transpose, and multiplication directly from raw JSON inputs."
  },
  "candidates": [
    {
      "candidate_id": "CANDIDATE-000001",
      "candidate_file_sha256": "sha256:be657af19493acdc2c3137d4200218fe7263a7a32b2cb2ed305f97d8e3947d7c",
      "published_scientific_payload_digest": "sha256:91b67470ddfade1770e76793fef54d2f3812ad41f726bda16a3246fb2b428b4b",
      "checks": {
        "metric.dimension": "PASS", "metric.symmetry": "PASS", "metric.determinant": "PASS", "metric.inverse": "PASS",
        "minkowski.components": "PASS", "minkowski.signature": "PASS", "minkowski.cosmological_constant": "PASS", "minkowski.constant_components": "PASS"
      },
      "observations": {"determinant": -1, "inverse": [[-1, 0, 0, 0], [0, 1, 0, 0], [0, 0, 1, 0], [0, 0, 0, 1]]}
    },
    {
      "candidate_id": "CANDIDATE-000002",
      "candidate_file_sha256": "sha256:f910fc6870e9560869e617e8e31af4afa743e2aefc50df7a9314b8904c5ed44d",
      "passport_file_sha256": "sha256:8dca8e8c18847fe3c52c51de7b7d0394f2c4170d39b47cf52eaea33f343a1601",
      "published_scientific_payload_digest": "sha256:73af7803b5ae10a9f8b1269398a126e6da94072b30a7e12da16f3e8f53e012d2",
      "checks": {
        "metric.dimension": "PASS", "metric.symmetry": "PASS", "metric.determinant": "PASS", "metric.inverse": "PASS",
        "coordinate_map.coordinates": "PASS", "coordinate_map.jacobian": "PASS", "coordinate_map.pullback": "PASS"
      },
      "observations": {
        "determinant": -14400,
        "inverse": [["-1/4", 0, 0, 0], [0, "1/9", 0, 0], [0, 0, "1/16", 0], [0, 0, 0, "1/25"]],
        "jacobian_determinant": 120,
        "pullback": [[-4, 0, 0, 0], [0, 9, 0, 0], [0, 0, 16, 0], [0, 0, 0, 25]]
      }
    }
  ],
  "comparison": "MATCH",
  "conflict_of_interest": {
    "disclosed": true,
    "operator": "ChefMrFrizzle with Codex",
    "overlaps": [
      "project owner and repository author",
      "same Codex collaborator used for implementation",
      "same physical machine and GitHub credentials",
      "same repository history, despite a clean remote clone"
    ]
  },
  "independence": {
    "clean_remote_clone": true,
    "separate_library": true,
    "separate_implementation": true,
    "separate_machine": false,
    "separate_contributor": false,
    "counts_as_external_reproduction": false,
    "level": "R2_INTERNAL_CLEAN_CLONE_SEPARATE_LIBRARY"
  },
  "signature": {
    "status": "UNSIGNED_NO_KEY",
    "content_digest_is_not_a_signature": true,
    "reason": "No Git signing key, GPG secret key, or SSH-agent signing identity was configured in the reproduction environment."
  },
  "limitations": [
    "This run is regression and portability evidence, not an outside scientific reproduction.",
    "SymPy is a separate library path, but the same project owner, Codex collaborator, machine, repository history, and credentials were involved.",
    "JSON Schema conformance is not independently reimplemented by this path.",
    "A named outside contributor and verifiable signature remain required for external reproduction credit."
  ],
  "record_digest": "sha256:aa34b7186dc8d583d3f313cb97343e4b2083ee10c13efa7f8f010d141b349600"
}
